name,address,long,lat
牛頭角道體育館,九龍觀塘牛頭角道183號牛頭角市政大廈4樓,114-12-59,22-19-17
寶翠公園,新界將軍澳毓雅里,114-15-11,22-19-30
啓德郵輪碼頭公園,九龍承豐道33號,114-12-49,22-18-21
香港中央圖書館,香港銅鑼灣高士威道66號,0114/11/23,22-16-48
九龍公園,九龍尖沙咀柯士甸道22號,0114/10/13,22-18-0
土瓜灣公共圖書館,九龍馬頭圍道165號土瓜灣政府合署5至6樓,0114/11/17,22-19-2
鯉魚門體育館,九龍油塘鯉魚門徑6號鯉魚門市政大廈2樓及5樓,114-14-19,22-17-31
蝴蝶灣社區中心,新界屯門蝴蝶邨地下及1樓,113-57-43,22-22-29
東區法院大樓,香港西灣河太安街29號,114-13-27,22-17-4
大元社區會堂,新界大埔大元邨,0114/10/7,22-27-20
九龍灣體育館,九龍九龍灣啟樂街15號地下,114-12-40,22-19-37
運輸署沙田牌照事務處,新界沙田上禾輋路1號沙田政府合署2樓,0114/11/13,22-23-8
石硤尾公園,九龍深水埗石硤尾南昌街270號,0114/10/16,22-20-19
荔枝角公園體育館,九龍荔枝角荔灣道1 號地下及1樓,0114/8/18,22-20-27
鴨脷洲風之塔公園,香港鴨脷洲利枝道,0114/9/7,22-14-43
大角咀公共圖書館,九龍大角咀福全街63號大角咀市政大厦3樓,114-9-46,22-19-19
九龍寨城公園,九龍九龍城東正道,0114/11/25,22-19-55
茜草灣鄰里社區中心,九龍觀塘茶果嶺道81號,114-13-44,22-18-26
恒安體育館,新界沙田馬鞍山恒安邨恒安商場4樓,114-13-40,22-25-0
稅務局-商業登記署,香港灣仔告士打道5號稅務大樓4樓,0114/10/19,22-16-47
入境事務及人事登記 - 火炭辦事處,新界火炭樂景街2至18號銀禧薈4樓405及406號鋪位,114-11-59,22-23-47
坑口社區會堂,新界將軍澳坑口培成路38號西貢將軍澳政府綜合大樓地下,114-16-6,22-19-2
香港單車館,新界將軍澳寶康路105-107號,114-15-45,22-18-47
大埔社區中心,新界大埔鄉事會街2號地下,114-9-58,22-26-48
駱克道街市熟食中心,香港灣仔駱克道225號2樓,114-10-32,22-16-41
鴨脷洲社區會堂,香港鴨脷洲鴨脷洲邨鴨脷洲社區會堂地下,0114/9/1,22-14-42
運輸署九龍灣驗車中心,九龍九龍灣祥業街2號地下,114-12-44,22-19-3
沙咀道遊樂場,新界荃灣沙咀道171-199號,114-6-48,22-22-19
荃灣民政事務處 - 諮詢服務中心,新界荃灣青山公路荃灣段174-208號荃灣多層停車場大廈1樓,0114/7/7,22-22-21
華貴社區中心,香港奇力灣華貴邨地下,0114/8/17,22-15-1
長發體育館,新界青衣長發邨長發商場4樓,0114/6/11,22-21-45
高等法院,香港金鐘道38號,114-9-48,22-16-42
和興社區會堂,新界粉嶺和鳴里7號地下,114-8-33,22-29-6
佛光街體育館,九龍何文田牧愛街18號9至10樓,114-10-52,22-18-53
上環文娛中心,香港皇后大道中345號上環市政大廈五樓,114-8-60,22-17-10
東頭社區中心,九龍黃大仙樂善道 26 號,114-11-37,22-19-55
保榮路體育館,新界上水百和路19號,114-7-42,22-29-49
大埔體育館,新界大埔汀太路13號地下及1樓,114-9-54,22-27-19
入境事務處 - 延期逗留組,香港灣仔告士打道7號入境事務大樓5樓,0114/10/23,22-16-47
龍興公共圖書館,九龍黃大仙下邨(二區)龍興樓地下北翼,114-11-34,22-20-26
沙田法院大樓,新界沙田宜正里1號,0114/11/21,22-22-48
天水圍北公共圖書館,新界天水圍天澤邨天澤商場3樓,113-59-55,22-28-6
機場核心計劃展覽中心,新界荃灣青山公路401號,0114/4/13,22-21-51
飲食業招聘中心及零售業招聘中心,香港灣仔告士打道5號稅務大樓地下,0114/10/19,22-16-47
龍逸社區會堂,新界屯門業旺路106號,113-58-5,22-23-11
法律援助署總部,香港金鐘道66號金鐘道政府合署25樓,114-9-51,22-16-41
天水圍體育館,新界元朗天水圍天柏路1號地下,114-0-24,22-27-18
田灣街市熟食中心,香港香港仔興和街11號2樓,114-8-54,22-15-1
公司註冊處,香港金鐘道66號 金鐘道政府合署14樓,114-9-50,22-16-40
運輸署九龍牌照事務處,九龍長沙灣道303號長沙灣政府合署2樓,114-9-37,22-19-54
西九龍就業中心,九龍長沙灣道303號長沙灣政府合署9樓,114-9-37,22-19-54
元朗公園,新界元朗公園北路,0114/1/8,22-26-33
聯和墟體育館,新界粉嶺聯和墟和滿街9號3樓,114-8-41,22-30-0
大澳公共圖書館,新界大嶼山大澳龍田邨商業中心12號舖,113-51-56,22-15-13
竹園體育館,九龍黃大仙竹園道竹園北邨2樓,114-11-37,22-20-44
曉光街體育館,九龍觀塘曉光街2號地下,114-13-40,22-19-11
屋宇署 - 樓宇資訊中心,九龍旺角彌敦道750號始創中心13樓,0114/10/8,22-19-22
坑口體育館,新界將軍澳培成路38號西貢將軍澳政府綜合大樓1至3樓,114-16-5,22-19-2
觀塘就業中心,九龍觀塘鯉魚門道12號東九龍政府合署10樓,114-13-47,22-18-34
順利邨公共圖書館,九龍觀塘順利邨道順利邨體育館3樓,114-13-32,22-19-47
修頓遊樂場,香港灣仔莊士敦道111號,0114/10/19,22-16-37
摩士3號公園,九龍黃大仙鳳舞街40號地下,0114/11/26,22-20-21
樂華社區中心,九龍觀塘樂華邨振華道80號,114-13-21,22-19-14
秀茂坪公共圖書館,九龍秀茂坪邨秀明樓104至109號地下,114-14-1,22-18-57
勞資審裁處,九龍油麻地加士居道36號,0114/10/23,22-18-28
蕙荃體育館,新界荃灣廟崗街6號地下及2樓,0114/7/21,22-22-20
石圍角社區會堂,新界荃灣石圍角邨,0114/7/27,22-22-28
淺水灣泳灘,香港淺水灣海灘道,114-11-47,22-14-12
灣仔法院,香港灣仔港灣道12號灣仔政府大樓,0114/10/21,22-16-48
荔枝角社區會堂,九龍深水埗荔枝角道863號地下(深盛路入口),114-8-52,22-20-2
城市藝坊,新界沙田源禾路一號,0114/11/19,22-22-50
仁愛母嬰健康院,新界屯門屯利街6號仁愛分科診所1樓,113-58-45,22-23-28
茶具文物館,香港中區紅棉路10號(香港公園內),114-9-45,22-16-43
黃竹坑體育館,香港黃竹坑道168號,0114/10/24,22-14-59
瑞和街公共圖書館,九龍觀塘瑞和街9號瑞和街市政大樓5至6樓,114-13-27,22-18-56
調景嶺公共圖書館,新界將軍澳翠嶺路4號,114-15-16,22-18-23
荔枝角公共圖書館,九龍荔枝角荔灣道19號地下至1樓,0114/8/19,22-20-25
九龍城公共圖書館,九龍衙前圍道100號九龍城市政大廈3樓,0114/11/20,22-19-47
土瓜灣政府合署,九龍土瓜灣馬頭圍道165號地下,0114/11/17,22-19-2
朗屏社區會堂,新界元朗朗屏邨朗屏社區會堂地下,0114/1/24,22-26-56
小西灣圖書館,香港柴灣小西灣道15號小西灣綜合大樓地下,114-14-58,22-15-49
鰂魚涌體育館,香港鰂魚涌鰂魚涌街38號鰂魚涌市政大廈6樓及7樓,114-12-42,22-17-1
北葵涌鄧肇堅體育館,新界葵涌和宜合路292號地下及1樓,0114/8/15,22-22-25
西灣河體育館,香港西灣河筲箕灣道111號2樓,114-13-22,22-16-56
順利社區中心,九龍順利邨順緻街2號地下,114-13-38,22-19-54
香港旅遊發展局 - 九龍旅客諮詢中心,九龍尖沙咀天星碼頭,0114/10/7,22-17-38
大興體育館,新界屯門青松觀路38號,113-58-23,22-24-11
隆亨社區中心,新界沙田隆亨邨,114-10-47,22-22-4
赤柱社區會堂,香港赤柱市場道6號赤柱市政大樓地面下層,114-12-44,22-13-9
瑞和街體育館,九龍觀塘瑞和街9號瑞和街市政大廈8樓,114-13-27,22-18-56
歌和老街壁球及乒乓球中心,九龍九龍塘歌和老街17號地下,0114/10/22,22-20-21
楓樹窩體育館,新界青衣青衣邨第2期楓樹窩路10號1樓,0114/6/10,22-21-20
赤柱正灘泳灘,香港赤柱赤柱灘道,114-12-51,22-13-16
利東社區會堂,香港鴨脷洲利東邨利東社區會堂地下及1樓,0114/9/17,22-14-30
中環街市,香港德輔道中80號2樓,0114/9/21,22-17-3
油尖旺民政事務處 - 諮詢服務中心,九龍旺角聯運街30號旺角政府合署地下,0114/10/21,22-19-17
保安道體育館,九龍深水埗保安道325-329號保安道市政大廈1樓及2樓,0114/9/27,22-20-19
龍琛路體育館,新界上水馬會道155號地下,114-7-50,22-30-18
柴灣體育館,香港柴灣怡順街6號地下、1樓及3樓,114-14-24,22-15-53
天晴社區會堂,新界天水圍天華路天晴邨地下,114-0-7,22-27-47
西貢海濱公園,新界西貢惠民路,114-16-29,22-22-57
大埔運動場,新界大埔頭路21號,114-9-44,22-27-19
高山劇場,九龍紅磡高山道77號,0114/11/7,22-18-49
赤柱公共圖書館,香港赤柱赤柱市場道6號赤柱市政大廈地面上層,114-12-44,22-13-9
朗屏體育館,新界元朗朗屏邨朗屏商場2樓202號,0114/1/23,22-27-1
駿業熟食市場,九龍觀塘駿業街67號地下至1樓,114-13-22,22-18-43
啟德郵輪碼頭,九龍承豐道33號,114-12-46,22-18-24
興華社區會堂,香港柴灣興華(二)邨,114-14-4,22-15-50
藍田(西區)社區中心,藍田啟田道71號,114-14-2,22-18-32
園圃街雀鳥花園,九龍旺角園圃街,0114/10/26,22-19-34
電氣道街市熟食中心,香港砲台山電氣道229號電氣道市政大廈2樓,114-11-37,22-17-22
旺角警署,九龍太子道西 142 號,0114/10/8,22-19-27
大埔文娛中心,新界大埔安邦路12號,0114/10/4,22-27-7
愉景灣社區會堂,愉景灣海澄湖畔路99號,114-0-57,22-18-30
青衣母嬰健康院,新界靑衣長康邨長康商場一期3樓,0114/6/21,22-20-56
上環街市熟食中心,香港上環皇后大道中345號上環市政大廈2樓,114-8-59,22-17-10
愛秩序灣街市熟食中心,香港筲箕灣愛秩序灣道15號地下,114-13-38,22-16-48
新蒲崗公共圖書館,"九龍新蒲崗崇齡街33號,新蒲崗廣場3樓",114-11-45,22-20-6
藍田公共圖書館,九龍藍田慶田街一號藍田綜合大樓 5 至 6 樓,114-14-15,22-18-36
油麻地戲院,九龍窩打老道 6 號,0114/10/9,22-18-45
水務署 - 灣仔客戶諮詢中心,香港灣仔告士打道7 號入境事務大樓1樓,0114/10/22,22-16-47
林邊生物多樣性自然教育中心,香港鰂魚涌柏架山道50號,114-12-41,22-16-53
香港藝術館,九龍尖沙咀梳士巴利道10號地庫、1至4樓,0114/10/19,22-17-36
北角就業中心,香港北角渣華道333號北角政府合署12樓,0114/12/30,22-17-32
富善體育館,新界大埔富善邨多層停車場6樓,0114/10/27,22-27-14
紅磡街市熟食中心,九龍紅磡馬頭圍道11號紅磡市政大廈2樓,0114/11/14,22-18-26
上水就業中心,新界上水龍琛路39號上水廣場20樓2001-2006室,114-7-40,22-30-9
蝴蝶邨公共圖書館,新界屯門蝴蝶邨蝶聚樓地下123-130號,113-57-47,22-22-36
北區民政事務處 - 諮詢服務中心,新界粉嶺璧峰路3號北區政府合署地下,0114/8/18,22-29-41
彩虹道體育館,九龍鑽石山彩虹道150號,114-11-47,22-20-14
荔枝角公園,九龍荔枝角荔灣道1號,0114/8/19,22-20-4
富亨鄰里社區中心,新界大埔富亨邨第4期地下,0114/10/19,22-27-36
中國客運碼頭,九龍尖沙咀廣東道33號中國客運碼頭2樓離境層旅客候船室,114-9-58,22-17-57
屯門大會堂,新界屯門屯喜路3號,113-58-38,22-23-31
柏立基夫人母嬰健康院,香港北角七姊妹道140號柏立基夫人健康院1樓,0114/12/18,22-17-29
觀塘法院大樓,九龍觀塘鯉魚門道10號,114-13-46,22-18-35
旺角熟食市場,九龍旺角上海街557號旺角綜合大樓2樓,0114/10/5,22-19-7
將軍澳運動場,新界將軍澳寶康路109號,114-15-47,22-18-42
元朗政府合署,新界元朗橋樂坊2號地下,114-1-38,22-26-43
石塘咀公共圖書館,香港皇后大道西470號石塘咀市政大廈3至4樓,0114/8/10,22-17-9
離島民政事務處 - 長洲諮詢服務中心,新界長洲新興街22號地下,114-1-44,22-12-37
南區民政事務處 - 諮詢服務中心,香港香港仔海傍道3號逸港居地下,114-9-33,22-14-50
打鼓嶺社區會堂,新界打鼓嶺坪輋路136號打鼓嶺鄉村中心政府大樓地下,114-9-38,22-31-28
香港大球場,香港掃桿埔東院道55號,0114/11/19,22-16-20
長青社區中心,新界青衣青康路 6 號,0114/6/25,22-20-56
屯門公園,新界屯門鄉事會路,113-58-27,22-23-29
摩士公園體育館,九龍黃大仙鳳舞街40號地下,0114/11/24,22-20-18
何文田體育館,九龍何文田忠義街1號地下、大堂及一樓,114-10-52,22-18-43
九龍出生登記處,九龍尖沙咀金巴利街28號地下低層,0114/10/26,22-18-2
荃景圍體育館,新界荃灣美環街38號,114-6-41,22-22-40
沙田民政事務處 - 諮詢服務中心,新界沙田上禾輋路1號沙田政府合署地下,0114/11/13,22-23-8
九龍公園體育館,九龍尖沙咀柯士甸道22號地下,0114/10/11,22-18-6
沙田公共圖書館,新界沙田源禾路1號,0114/11/21,22-22-50
西港島就業中心,香港西營盤薄扶林道2號A西區裁判署4字樓,0114/8/26,22-17-13
三棟屋博物館,新界荃灣古屋里2號,0114/7/13,22-22-19
鰂魚涌街市熟食中心,香港鰂魚涌街38號鰂魚涌市政大廈閣樓,114-12-42,22-17-1
健彩社區會堂,新 界 將 軍 澳 健 明 邨 彩 明 商 場 擴 展 部 份 六 樓,114-15-4,22-18-22
入境事務處 - 沙田辦事處,新界沙田上禾輋路1號沙田政府合署3樓,0114/11/13,22-23-8
稅務局-印花稅署,香港灣仔告士打道5號稅務大樓3樓,0114/10/19,22-16-47
中山紀念公園,新界西營盤東邊街北,114-8-44,22-17-24
南朗山道熟食市場,香港黃竹坑南朗山道1號地下及1樓,114-9-59,22-14-51
土瓜灣街市熟食中心,九龍土瓜灣馬頭圍道165號地下,0114/11/17,22-19-2
灣仔運動場,香港灣仔杜老誌道20號,114-10-41,22-16-53
鳳德社區中心,九龍黃大仙鑽石山鳳德道111號鳳德邨地下,0114/12/6,22-20-35
九龍城街市熟食中心,九龍九龍城衙前圍道100號九龍城市政大廈2樓,0114/11/20,22-19-47
天暉路體育館,新界天水圍天瑞路63號,113-59-49,22-27-53
耀東公共圖書館,香港筲箕灣耀東邨耀昌樓地下,114-13-32,22-16-37
荃灣裁判法院,新界荃灣大河道70號,114-6-47,22-22-16
尖沙咀警署,九龍彌敦道213號,0114/10/17,22-18-10
赤柱海濱小賣亭及赤柱海濱長廊,香港赤柱市場道20號及香港赤柱大街,114-12-41,22-13-6
香港仔網球及壁球中心,香港香港仔海旁道1號地下及1樓,114-9-35,22-14-51
曹公潭戶外康樂中心,新界荃灣荃錦公路105號,0114/6/22,22-23-10
梁顯利油麻地社區中心,九龍油麻地眾坊街60號地下及3樓,0114/10/11,22-18-36
衞生教育展覽及資料中心,九龍尖沙咀九龍公園S4座地下至1樓,0114/10/17,22-17-54
香港仔體育館,香港香港仔大道203號香港仔市政大廈5樓,0114/9/16,22-14-58
美林體育館,新界沙田大圍美林邨第3期地下、1至2樓,114-10-32,22-22-45
修頓中心,香港灣仔軒尼詩道130號1樓,0114/10/22,22-16-39
麥理浩夫人度假村,西貢北潭,114-19-18,22-24-29
工業貿易署大樓,九龍旺角彌敦道700號地下及閣樓,0114/10/10,22-19-14
梨木樹社區會堂,新界荃灣梨木樹康樹樓地下,0114/8/13,22-22-45
太和體育館,新界大埔太和邨太和商場平台,114-9-38,22-27-4
元州街公共圖書館,九龍元州街59-63號元州街市政大廈1樓,114-9-48,22-19-55
灣仔民政事務處 - 諮詢服務中心,香港灣仔柯布連道2號地下,0114/10/23,22-16-38
屯門鄧肇堅運動場,新界屯門青松觀路,113-58-27,22-24-15
入境事務處 - 西九龍辦事處,九龍尖沙咀金巴利街28號地下,0114/10/26,22-18-2
大會堂公共圖書館,香港中環大會堂高座2至6樓及8至11樓,114-9-39,22-16-56
觀塘社區中心,九龍觀塘翠屏道17號,114-13-46,22-18-47
皇后街熟食市場,香港上環德輔道西38號1樓,114-8-51,22-17-14
九龍城體育館,九龍九龍城衙前圍道100號九龍城市政大廈3樓,0114/11/20,22-19-47
西貢戶外康樂中心,新界西貢對面海區康健路21號,114-16-9,22-22-35
大坑東社區中心,九龍深水埗大坑東棠蔭街17號地下,0114/10/13,22-19-50
城門郊野公園遊客中心,新界荃灣城門道,114-8-37,22-23-6
香港濕地公園訪客中心,新界天水圍濕地公園路,114-0-18,22-28-7
香港文物探知館,九龍尖沙咀海防道九龍公園,0114/10/11,22-17-58
終審法院,香港中環炮台里1號,114-9-35,22-16-46
京士柏曲棍球場,九龍衛理道六號,114-10-39,22-18-25
紅磡海濱長廊,九龍紅磡建灣街,0114/11/16,22-18-1
天瑞體育館,新界元朗天水圍天瑞路7號地下及1樓,113-59-53,22-27-17
西九龍母嬰健康院,九龍深水埗長沙灣道303號長沙灣政府合署西九龍健康中心2樓,114-9-37,22-19-55
海港政府大樓,香港中區統一碼頭道38號地下及1樓,0114/9/18,22-17-12
香港公園,香港中環紅棉路19號,114-9-41,22-16-38
屯門康樂體育中心,新界屯門龍門路54號,113-57-46,22-22-54
牛池灣街市熟食中心,九龍牛池灣清水灣道11號牛池灣街市2樓,114-12-32,22-20-4
青衣體育館,新界青衣青綠街38號青衣市政大廈2樓,0114/6/23,22-21-15
鯉魚門公共圖書館,九龍觀塘鯉魚門徑6號鯉魚門市政大廈1樓,114-14-19,22-17-31
大興社區會堂,新界屯門大興邨,113-58-13,22-24-8
廣源社區會堂,新界沙田小瀝源路68號廣源邨,114-12-52,22-22-51
翠林社區會堂,新界將軍澳翠林邨,114-14-53,22-19-28
南昌社區中心,九龍深水埗昌新里1號地下、1樓及4樓,0114/9/27,22-19-38
赤柱正灘水上活動中心,香港赤柱赤柱連合道,114-12-51,22-13-13
石塘咀體育館,香港皇后大道西470號石塘咀市政大廈5樓,0114/8/10,22-17-9
彩雲社區中心,九龍牛池灣彩雲邨彩鳳徑38號,114-12-50,22-20-6
葵盛社區會堂,新界葵涌葵盛西邨第 6 座平台,0114/7/18,22-21-41
粉嶺公共圖書館,新界粉嶺和滿街9號2樓,114-8-41,22-30-1
石湖墟街市熟食中心,新界上水智昌路13號石湖墟市政大廈2樓,114-7-51,22-30-8
山頂道花園,香港山頂山頂道,114-8-59,22-16-15
漁灣社區會堂,香港柴灣柴灣道365號漁灣邨,114-14-29,22-15-58
紅磡社區會堂,九龍紅磡庇利街42號九龍城政府合署,0114/11/23,22-18-43
蒲崗村道體育館,九龍黃大仙蒲崗村道120號地下至2樓,0114/12/6,22-20-44
黃泥涌街市熟食中心,香港跑馬地毓秀街2號黃泥涌市政大廈2樓,0114/11/9,22-16-8
保安道公共圖書館,九龍深水埗保安道325-329號保安道市政大廈2樓,0114/9/27,22-20-19
天暉路社區會堂,新界元朗天水圍天暉路,113-59-50,22-27-55
九龍灣運動場,九龍灣啟樂街1號,114-12-35,22-19-36
元朗公共圖書館,新界元朗橋樂坊2號元朗政府合署1樓,114-1-38,22-26-43
黃大仙民政事務處 - 諮詢服務中心,九龍黃大仙龍翔道138號龍翔辦公大樓2樓201室,114-11-32,22-20-31
入境事務處 - 東九龍辦事處,九龍藍田匯景道1-17號匯景花園匯景廣場第2層,114-14-1,22-18-26
石塘咀街市熟食中心,香港石塘咀皇后大道西470號石塘咀市政大廈2樓,0114/8/10,22-17-9
長發社區中心,新界青衣担杆山路 6 號,0114/6/10,22-21-48
旺角大球場,九龍旺角花墟道37號,0114/10/22,22-19-34
荃灣大會堂,新界荃灣大河道72號,114-6-47,22-22-14
山景社區會堂,新界屯門山景邨,113-57-56,22-23-47
黃大仙社區中心,九龍黃大仙正德街104號,114-11-40,22-20-28
大埔民政事務處 - 諮詢服務中心,新界大埔汀角路1號大埔政府合署地下,114-9-51,22-27-3
九龍城民政事務處 - 諮詢服務中心,九龍紅磡庇利街42號九龍城政府合署低層地下,0114/11/23,22-18-43
香港仔海濱公園,香港香港仔海傍道,0114/9/14,22-14-51
南丫島南段公共圖書館,新界南丫島索罟灣第2街地下,114-7-54,2022/12/21
楊屋道體育館,新界荃灣楊屋道45號楊屋道市政大廈4樓,114-6-52,22-22-8
瀝源公共圖書館,新界沙田瀝源邨貴和樓地下101-110號,0114/11/26,22-23-5
葵青劇院,新界葵涌興寧路12號,114-7-34,22-21-24
鴨脷洲街市熟食中心,香港鴨脷洲洪聖街8號鴨脷洲市政大廈1樓,0114/9/20,22-14-40
官涌街市熟食中心,九龍油麻地寶靈街17號官涌市政大廈2樓,0114/10/6,22-18-16
港灣道體育館,香港灣仔港灣道27號地下及1樓,114-10-35,22-16-53
香港文化中心,九龍尖沙咀梳士巴利道10號,0114/10/14,22-17-38
大埔墟體育館,新界大埔鄉事會街8號大埔綜合大樓6至7樓,114-9-60,22-26-46
屯門法院大樓,新界屯門屯喜路1號,113-58-32,22-23-25
東九龍就業中心,九龍新蒲崗太子道東698號寶光商業中心7樓705-6室,114-11-54,22-20-3
入境事務處 - 查詢及聯絡組,香港灣仔告士打道7號入境事務大樓2樓,0114/10/23,22-16-47
北角公共圖書館,香港北角百福道北角街市大廈地下,0114/12/20,22-17-29
沙田政府合署,新界沙田上禾輋路1號地下,0114/11/13,22-23-8
青衣運動場,新界青衣青敬路51號,0114/6/29,22-21-23
土瓜灣體育館,九龍土瓜灣下鄉道66號地下及1樓,0114/11/24,22-19-8
油蔴地公共圖書館,九龍上海街250號地下及閣樓,0114/10/14,22-18-33
人事登記處 - 港島辦事處,香港灣仔告士打道7號入境事務大樓8樓,0114/10/23,22-16-47
廣福社區會堂,新界大埔廣福邨,0114/10/27,22-26-50
建生社區會堂,新界屯門建生邨建生社區會堂地下,113-58-9,22-24-23
北區運動場,新界上水天平路 26 號,114-7-49,22-30-23
石圍角公共圖書館,新界荃灣石圍角邨石芳樓215-219室,0114/7/27,22-22-29
東涌文東路體育館,新界大嶼山東涌文東路39號東涌市政大樓地下至2樓,113-56-38,22-17-26
西貢公共圖書館,"新界西貢親民街34號,西貢政府合署5樓",114-16-20,22-22-56
荃灣政府合署,新界荃灣西樓角道38號2樓及4樓,114-6-54,22-22-29
北葵涌公共圖書館,新界葵涌石蔭路北葵涌街市及圖書館2樓及3樓,0114/8/19,22-22-14
天秀墟,新界天水圍天秀路18號,114-0-2,22-27-57
屏山鄧族文物館暨文物徑訪客中心,新界元朗屏山坑頭村,114-0-37,22-26-45
鰂魚涌公共圖書館,香港鰂魚涌鰂魚涌街38號鰂魚涌市政大廈4至5樓,114-12-42,22-17-1
湖山路社區會堂,新界屯門湖山路101號,113-58-7,22-22-37
香港歷史檔案大樓,九龍觀塘翠屏道13號,114-13-46,22-18-46
九龍政府合署,九龍油麻地彌敦道405號地下,0114/10/15,22-18-34
人事登記處 - 觀塘辦事處,觀塘偉業街223-231號宏利金融中心2樓3號辦公室,114-13-26,22-18-27
屏山天水圍公共圖書館,新界天水圍聚星路1號屏山天水圍文化康樂大樓高座,114-0-17,22-26-51
聯和墟社區會堂,新界粉嶺聯和墟和滿街9號地下,114-8-41,22-30-1
九龍城法院大樓,九龍亞皆老街147M號,0114/11/7,22-19-31
北河街體育館,九龍深水埗基隆街333號北河街市政大廈5樓、6樓及U6樓,114-9-40,22-19-45
禮頓山社區會堂,香港跑馬地黃泥涌道133號地下,114-10-59,22-16-32
九龍仔公園,九龍塘延文禮士道,0114/11/1,22-19-57
西區社區中心,香港西營盤西邊街36號A,0114/8/27,22-17-9
香港公園體育館,香港中環紅棉路29號地下至2樓,114-9-33,22-16-38
西貢賽馬會大會堂,新界西貢親民街8號,114-16-17,22-22-59
入境事務處 - 港島區簽發旅行證件辦事處,香港中環統一碼頭道38號海港政府大樓2樓,0114/9/18,22-17-12
漁光道體育館,香港香港仔漁光道43號,0114/9/25,22-15-2
投資推廣署,香港中環紅棉路8號東昌大廈25字樓,114-9-46,22-16-48
鳳琴街體育館,新界元朗鳳攸北街20號地下,114-1-59,22-26-35
孫中山紀念館,香港中環衛城道7號,0114/9/3,22-16-55
中西區民政事務處 - 諮詢服務中心,香港中環統一碼頭道38號海港政府大樓地下,0114/9/18,22-17-12
牛池灣公共圖書館,九龍清水灣道11號牛池灣市政大廈5至6樓,114-12-34,22-20-4
石硤尾公園體育館,九龍深水埗南昌街290 號地下至2樓,0114/10/12,22-20-14
白田社區會堂,九龍石硤尾白田街白田邨地下至1樓,114-9-60,22-20-10
荃灣公共圖書館,新界荃灣西樓角路38號3至5樓,114-6-56,22-22-27
離島民政事務處 - 東涌諮詢服務中心,新界大嶼山東涌美東街6號東涌郵政局大廈1樓,113-56-22,22-17-21
鵝頸街市熟食中心,香港灣仔寶靈頓道21號1樓,114-10-49,22-16-42
順利邨體育館,九龍觀塘順利邨道地下至2樓,114-13-32,22-19-47
中山紀念公園體育館,香港西營盤東邊街北18號,114-8-37,22-17-25
法律援助署九龍分署,九龍旺角聯運街30號旺角政府合署3樓,0114/10/21,22-19-17
石澳泳灘,香港石澳石澳道,114-15-3,22-13-43
稅務局-中央詢問處,香港灣仔告士打道5號稅務大樓1樓,0114/10/19,22-16-47
青嶼幹線訪客中心,青衣島西北面,114-4-53,22-21-31
蒲崗村道公園,九龍黃大仙鑽石山蒲崗村道140號,0114/12/13,22-20-38
葵興政府合署,新界葵涌興芳路166-174號地下及2樓,114-7-54,22-21-47
馬鞍山體育館,新界沙田馬鞍山鞍駿街14號地下及1樓,114-13-46,22-25-34
港島東體育館,香港西灣河鯉景道52號地下,114-13-20,22-17-5
太和鄰里社區中心,新界大埔太和邨,114-9-41,22-27-10
瑞和街街市熟食中心,九龍觀塘瑞和街9號第4層,114-13-27,22-18-56
柴灣公共圖書館,香港柴灣柴灣道338號柴灣市政大廈4樓及5樓,114-14-24,22-15-48
西貢民政事務處 - 諮詢服務中心,新界將軍澳坑口培成路38號西貢將軍澳政府綜合大樓地下,114-16-5,22-19-1
寶康公園,新界將軍澳運隆路,114-15-28,22-19-8
沙頭角社區會堂,新界沙頭角順興街55號,114-13-22,22-32-46
士美非路體育館,香港堅尼地城士美非路12號K士美非路市政大廈4至6樓,114-7-43,22-16-55
小西灣運動場,香港小西灣富康街8號,114-14-57,22-16-3
土地審裁處,九龍油麻地加士居道38號土地審裁處,0114/10/22,22-18-30
九龍灣公園 - 11人足球場(人造草),九龍灣啟禮道11號,0114/12/25,22-19-37
九龍公園游泳池,九龍尖沙咀柯士甸道22號九龍公園游泳池,0114/10/13,22-18-7
長洲體育館,新界長洲長洲醫院路3號地下及1樓,114-1-52,2022/12/27
良田體育館,新界屯門田景邨停車場4字樓,113-57-54,22-24-24
香港歷史博物館,九龍尖沙咀漆咸道南100號,114-10-39,22-18-6
伊利沙伯體育館,香港灣仔愛群道18號,114-10-44,22-16-31
